{
  "schema_version": "1.0.0",
  "critic_report_id": "critic-reference-undertransfer",
  "project_id": "project-contract-test",
  "run_id": "run-critic-reference-undertransfer",
  "generation_result_ref": {
    "artifact_id": "generation-critic-reference-undertransfer",
    "artifact_version": "1.0.0",
    "artifact_uri": "mock://synthetic/generation-critic-reference-undertransfer"
  },
  "final_frame_spec_ref": {
    "artifact_id": "frame-critic-reference-undertransfer",
    "artifact_version": "1.0.0",
    "artifact_uri": "mock://synthetic/frame-critic-reference-undertransfer"
  },
  "image_evidence": {
    "output_id": "output-critic-reference-undertransfer",
    "image_uri": "mock://synthetic-image/critic-reference-undertransfer.png",
    "availability": "AVAILABLE",
    "evidence_type": "TEST_DATA_DESCRIPTOR",
    "data_classification": "SYNTHETIC_TEST_DATA"
  },
  "evidence": [
    {
      "evidence_id": "ev-reference-undertransfer",
      "evidence_type": "TEST_ASSERTION",
      "source_ref": "mock://synthetic-evidence/ev-reference-undertransfer",
      "description": "Synthetic comparison representing insufficient transfer of approved reference attributes.",
      "data_classification": "SYNTHETIC_TEST_DATA",
      "confidence": "HIGH"
    }
  ],
  "review_status": "FAIL",
  "blind_visual_review": {
    "status": "PASS",
    "review_context": "BLIND_TO_SPEC",
    "scope": "GENERAL_QUALITY",
    "dimensions": [
      {
        "dimension": "COMPOSITION",
        "verdict": "PASS",
        "score": 82,
        "confidence": "HIGH",
        "evidence_ids": [
          "ev-reference-undertransfer"
        ],
        "rationale": "Synthetic general composition remains acceptable."
      }
    ],
    "issues": [],
    "summary": "Synthetic blind review passes general quality."
  },
  "spec_compliance_review": {
    "status": "FAIL",
    "review_context": "WITH_SPEC_CONTEXT",
    "scope": "SPEC_COMPLIANCE",
    "checks": [
      {
        "check_id": "check-reference-transfer",
        "requirement_type": "REFERENCE",
        "source_path": "/reference_constraints",
        "verdict": "FAIL",
        "evidence_ids": [
          "ev-reference-undertransfer"
        ],
        "message": "Synthetic reference-transfer check fails."
      }
    ],
    "issues": [
      {
        "issue_id": "issue-reference-undertransfer",
        "phase": "SPEC_COMPLIANCE_REVIEW",
        "category": "REFERENCE_UNDERTRANSFER",
        "severity": "HIGH",
        "scope": "SPEC_COMPLIANCE",
        "description": "Synthetic output transfers too little of the declared reference plan.",
        "evidence_ids": [
          "ev-reference-undertransfer"
        ],
        "affected_regions": [
          {
            "region_id": "full-frame",
            "label": "Full frame",
            "geometry": {
              "kind": "FULL_FRAME"
            }
          }
        ],
        "violated_requirement": {
          "source_artifact": "REFERENCE_TRANSFER_PLAN",
          "source_path": "/transfer_directives/0",
          "requirement_id": "reference-transfer",
          "statement": "Transfer the declared spatial rhythm and material contrast."
        },
        "responsible_node": "REFERENCE_TRANSLATOR",
        "recommended_return_depth": "REFERENCE_TRANSLATOR",
        "blocking": true
      }
    ],
    "protected_fields_summary": {
      "checked_paths": [
        "/identity_system",
        "/typography_system",
        "/composition_system"
      ],
      "lost_paths": [],
      "status": "PRESERVED"
    },
    "summary": "Synthetic spec review detects reference undertransfer."
  },
  "my_eyes": {
    "status": "EVIDENCE_UNAVAILABLE",
    "scope": "DESIGNER_PREFERENCE",
    "evidence_ids": [],
    "preference_findings": [],
    "unavailable_reason": "No approved direction memory, real approved/rejected images, A/B comparisons, human reasons, or recurrent preference evidence is available.",
    "summary": "Designer preference was not inferred."
  },
  "overall_assessment": {
    "general_quality_outcome": "PASS",
    "spec_compliance_outcome": "FAIL",
    "designer_preference_outcome": "UNKNOWN",
    "blocking_issue_ids": [
      "issue-reference-undertransfer"
    ],
    "rationale": "Synthetic contract-test outcome for critic-reference-undertransfer; it is not a real visual judgment."
  },
  "routing": {
    "action": "CREATE_DELTA_FIX_PLAN",
    "minimum_return_depth": "REFERENCE_TRANSLATOR",
    "responsible_nodes": [
      "REFERENCE_TRANSLATOR"
    ]
  },
  "human_judgment": {
    "status": "NOT_PROVIDED",
    "critic_decision": "FAIL",
    "human_decision": null,
    "operational_decision": "FAIL",
    "disagreement_preserved": false,
    "human_evidence_ids": []
  },
  "warnings": [],
  "provenance": {
    "producer": "IMAGE_CRITIC",
    "producer_version": "1.0.0-contract-test",
    "created_at": "2026-08-10T12:00:00.000Z",
    "sources": [
      "synthetic-contract-fixture"
    ],
    "data_classification": "SYNTHETIC_TEST_DATA",
    "notes": "TEST DATA ONLY. This fixture does not describe a real image, human preference, approval, rejection, or visual analysis."
  }
}
