{
  "schema_version": "1.0.0",
  "critic_report_id": "critic-my-eyes-evidence-unavailable",
  "project_id": "project-contract-test",
  "run_id": "run-critic-my-eyes-evidence-unavailable",
  "generation_result_ref": {
    "artifact_id": "generation-critic-my-eyes-evidence-unavailable",
    "artifact_version": "1.0.0",
    "artifact_uri": "mock://synthetic/generation-critic-my-eyes-evidence-unavailable"
  },
  "final_frame_spec_ref": {
    "artifact_id": "frame-critic-my-eyes-evidence-unavailable",
    "artifact_version": "1.0.0",
    "artifact_uri": "mock://synthetic/frame-critic-my-eyes-evidence-unavailable"
  },
  "image_evidence": {
    "output_id": "output-critic-my-eyes-evidence-unavailable",
    "image_uri": "mock://synthetic-image/critic-my-eyes-evidence-unavailable.png",
    "availability": "AVAILABLE",
    "evidence_type": "TEST_DATA_DESCRIPTOR",
    "data_classification": "SYNTHETIC_TEST_DATA"
  },
  "evidence": [
    {
      "evidence_id": "ev-quality-only",
      "evidence_type": "TEST_ASSERTION",
      "source_ref": "mock://synthetic-evidence/ev-quality-only",
      "description": "Synthetic general-quality assertion with no designer-preference evidence.",
      "data_classification": "SYNTHETIC_TEST_DATA",
      "confidence": "HIGH"
    }
  ],
  "review_status": "PASS",
  "blind_visual_review": {
    "status": "PASS",
    "review_context": "BLIND_TO_SPEC",
    "scope": "GENERAL_QUALITY",
    "dimensions": [
      {
        "dimension": "HIERARCHY",
        "verdict": "PASS",
        "score": 86,
        "confidence": "HIGH",
        "evidence_ids": [
          "ev-quality-only"
        ],
        "rationale": "Synthetic hierarchy pass."
      }
    ],
    "issues": [],
    "summary": "Synthetic blind review passes."
  },
  "spec_compliance_review": {
    "status": "PASS",
    "review_context": "WITH_SPEC_CONTEXT",
    "scope": "SPEC_COMPLIANCE",
    "checks": [
      {
        "check_id": "check-unavailable-spec",
        "requirement_type": "COMPOSITION",
        "source_path": "/composition_system",
        "verdict": "PASS",
        "evidence_ids": [
          "ev-quality-only"
        ],
        "message": "Synthetic spec check passes."
      }
    ],
    "issues": [],
    "protected_fields_summary": {
      "checked_paths": [
        "/identity_system",
        "/typography_system",
        "/composition_system"
      ],
      "lost_paths": [],
      "status": "PRESERVED"
    },
    "summary": "Synthetic spec review passes."
  },
  "my_eyes": {
    "status": "EVIDENCE_UNAVAILABLE",
    "scope": "DESIGNER_PREFERENCE",
    "evidence_ids": [],
    "preference_findings": [],
    "unavailable_reason": "No approved direction memory, real approved/rejected images, A/B comparisons, human reasons, or recurrent preference evidence is available.",
    "summary": "Designer preference was not inferred."
  },
  "overall_assessment": {
    "general_quality_outcome": "PASS",
    "spec_compliance_outcome": "PASS",
    "designer_preference_outcome": "UNKNOWN",
    "blocking_issue_ids": [],
    "rationale": "Synthetic contract-test outcome for critic-my-eyes-evidence-unavailable; it is not a real visual judgment."
  },
  "routing": {
    "action": "ACCEPT",
    "minimum_return_depth": null,
    "responsible_nodes": []
  },
  "human_judgment": {
    "status": "NOT_PROVIDED",
    "critic_decision": "PASS",
    "human_decision": null,
    "operational_decision": "PASS",
    "disagreement_preserved": false,
    "human_evidence_ids": []
  },
  "warnings": [],
  "provenance": {
    "producer": "IMAGE_CRITIC",
    "producer_version": "1.0.0-contract-test",
    "created_at": "2026-08-10T12:00:00.000Z",
    "sources": [
      "synthetic-contract-fixture"
    ],
    "data_classification": "SYNTHETIC_TEST_DATA",
    "notes": "TEST DATA ONLY. This fixture does not describe a real image, human preference, approval, rejection, or visual analysis."
  }
}
